id,Title,_yoast_wpseo_focuskw
915,"AI & Python #18: AI Enthusiasts Should Move from Excel to Python. Here's How","move from excel to python"
917,"SearchGPT: Another Failed Attempt to Take Down Google?","searchgpt vs google search"
919,"All AI Tools And ChatGPT Prompts in 1 Article","best ai tools and chatgpt prompts"
921,"The AI Tool That Introverts Will Love","ai tool for introverts"
923,"How I Use AI and SQL in My Daily Work as a Data Analyst","using ai with sql in data analysis"
925,"4 Free Prompt Engineering Courses to Join The Top 1% of ChatGPT Users","free prompt engineering courses"
927,"The Birth of Modern AI","birth of modern ai"
929,"My Top 4 Paid Subscriptions I'll Never Cancel as a Programmer","top paid subscriptions for programmers"
931,"5 macOS Apps I Never Close as a Programmer","macos apps for programmers"
933,"🔎 The best new AI search","best ai search engines"
935,"Here's How Companies Will Use AI for Recruiting","ai in recruiting process"
937,"AI & Python #17: How to Convert a Python Script to an Executable File (.exe)","convert python script to exe"
939,"AI & Python #16: 4 Python Books I Read as a Self-Taught Programmer","best python books for beginners"
941,"How to Integrate ChatGPT Into Siri on Your iPhone","integrate chatgpt with siri"
943,"Apple Intelligence (AI) Finally Arrives on Apple Products","apple intelligence ai features"
945,"6 Free Websites (Powered by AI) That Every Content Creator Needs to Know","free ai tools for content creators"
947,"Automate or Get Automated: How I Changed My Life Learning to Automate (Instead of Coding)","learn to automate tasks"
949,"""AI Is Not Replacing Workers"" And Other Lies About AI","ai impact on jobs"
951,"AI & Python #15: Automate The Most Tedious Task on The Internet With Python","automate web form filling python"
953,"AI & Python #14: How to Automate Your Python Scripts on Mac and Windows","automate python scripts mac windows"
955,"ChatGPT Users Will Love These Amazing GPT-4o Use Cases","best uses for gpt-4o"
957,"How to Download The New ChatGPT Desktop App (even if you're not invited to the beta)","download chatgpt desktop app"
959,"AI & Python #13: How to Automate Your Excel Reporting with Python","automate excel reporting with python"
961,"OpenAI Just Unveiled The Best AI Model: GPT-4o","gpt-4o new features"
963,"AI & Python #12: How to Easily Create a PDF File with Python","create pdf file with python"
965,"You’re Not Unlocking ChatGPT’s Full Potential. Here’s How to Do It.","unlocking chatgpt plus features"
967,"AI Devices Are Not There Yet","ai devices limitations and challenges"
969,"AI & Python #11: How to Automate Emails with Python","automate emails with python"
971,"The Rise of AI Robots Just Got Real","rise of ai robots"
973,"3 ChatGPT-Like Extensions to Automate Your Life","chatgpt extensions for productivity"
975,"AI & Python #10: Automate 4 Boring Tasks in Python with 5 Lines of Code","automate boring tasks with python"
977,"The False Promises of AI","false promises of ai"
979,"3 Simple Ways ChatGPT Has Helped me Improve My Everyday Life","how to improve everyday life with chatgpt"
981,"10 Python Mistakes You Shouldn’t Make","common python mistakes beginners"
983,"5 AI Tools That Will Make Your Life Easier (Other Than ChatGPT)","best ai tools for productivity"
985,"What's the best Python Web Scraping library in 2024?","best python web scraping library 2024"
987,"AI & Python #9: Create AI Products with The OpenAI API","create ai products with openai api"
989,"The Pivotal Role of Nvidia in The Future of AI","nvidia role in artificial intelligence"
991,"Lesson #2: Vocabulary & Listening with AI","using chatgpt to learn vocabulary"
993,"Can ChatGPT Solve an Entire Data Analysis Project?","can chatgpt handle data analysis"
995,"The Jobs That Might Be Replaced by AI","jobs replaced by ai"
997,"AI & Python #8: Pandas Functions that Data Analysts Use 60% of the Time","pandas functions for data analysis"
999,"Is AI Officially Taking Our Jobs? Meet Devin, The First AI Software Engineer","ai software engineer job impact"
1001,"New Method: Web Scraping with ChatGPT Mentions","web scraping with chatgpt"
1003,"Here's What ChatGPT Code Interpreter Can Do for Data Analysts","chatgpt code interpreter data analysis"
1005,"Nvidia CEO Advises Against Learning to Code: Is Coding Still a Worthwhile Skill to Learn?","is coding still worth it"
1007,"AI & Python #7: Stop Overusing “+” to Join Strings in Python","string concatenation in python"
1009,"How Data Analysts Use ChatGPT","how data analysts use chatgpt"
1011,"PandasAI: Simple Data Analysis with AI and Python","pandasai for data analysis"
1013,"Claude 3 Beats GPT-4 in Benchmarks: Is That Enough to Switch?","claude 3 vs gpt-4 comparison"
1015,"How to Create Excel Formulas with ChatGPT","create excel formulas with chatgpt"
1017,"AI & Python #6: Web Scraping in Python with Selenium","web scraping with selenium"
1019,"AI Companies Have Been Scraping The Internet for Years. But Is Web Scraping Legal?","is web scraping legal"
1021,"AI & Python #5: Web Scraping in Python with Beautiful Soup","web scraping with beautiful soup"
1023,"Web Scraping in Python: Beautiful Soup, Selenium, or Scrapy?","best python web scraping tool"
1025,"AI & Python #4: The Easiest Way To Web Scrape with Python","web scraping with python"
1027,"No-Code Tools to Make Interactive Data Visualization","no-code interactive data visualization"
1029,"What you can do with data (besides training AI models)","uses of data for professionals"
1031,"You’re Not The Only One Feeling AI Fatigue (Or: Why That New AI Tool Isn't for You)","ai fatigue solutions"
1033,"AI & Python #3: Concepts You Should Know Before Learning Web Scraping","concepts for learning web scraping"
1035,"Gemini Ultra vs GPT-4: Did Google Beat GPT-4 This Time?","gemini ultra vs gpt-4 comparison"
1037,"No-Code Tools To Extract Data From Websites","no-code web scraping tools"
1039,"Data: An important resource in the AI revolution","importance of data in ai"
1041,"AI & Python #2: Two Tools Every Python Programmer Needs To Use","python virtual environments tutorial"
1043,"If You Like AI Art Tools, You'll Love These Custom GPTs","best gpts for ai art"
1045,"Are we really in an AI bubble?","are we in an ai bubble"
1047,"AI & Python #1: How to Learn Python with ChatGPT","learn python with chatgpt"
1049,"I Tried Multiple AI Coding Assistants. These Are The Best","best ai coding assistants"
1051,"How ChatGPT Has Changed The Lives of Programmers","how chatgpt helps programmers"
1053,"The Best GPTs for Programmers","best gpts for programmers"
1055,"How I'd Learn to Code Using ChatGPT","learn to code with chatgpt"
1057,"The Hidden Challenges of AI","challenges of artificial intelligence"
1059,"OpenAI Just Released The GPT Store. Here's How To Use It And Make Money With Your GPT","how to make money with gpt"
1061,"How to Create an Irresistible Resume (with ChatGPT and Overleaf)","create a modern resume template"
1063,"How ChatGPT Helped me Get a Job","chatgpt for job search"
1065,"Create AI Products in 2024 with the ChatGPT API","create ai products with chatgpt api"
1067,"Master ChatGPT by learning prompt engineering","learn prompt engineering techniques"
1069,"“Google Will Kill ChatGPT” and Other Overhyped AI Predictions We Heard In 2023","overhyped ai predictions 2023"
1071,"How ChatGPT Helps Me Prepare for Job Interviews","using chatgpt for interview preparation"
1073,"Master The Perfect ChatGPT Prompt Formula","how to create effective chatgpt prompts"
1075,"A Hands-On Comparison: Gemini Pro vs GPT-3.5","gemini pro vs gpt-3.5 comparison"
1077,"Here's Why I Still Don't Buy the Hype of Google Gemini","why google gemini is overrated"
1079,"GPT Actions: How to Create Advanced Automation in Your GPTs","gpt automation actions guide"
1081,"5 AI Tools That Will Help You Bring Images to Life","ai tools for animating images"
1083,"ChatGPT Prompts I Used To Become More Productive at Work","chatgpt productivity prompts for work"
1085,"Books About AI (Published Before the AI Hype)","books on artificial intelligence"
1087,"AI Tutorial: Creating a Custom ChatGPT That Extracts Data from Websites","create custom chatgpt for data extraction"
1089,"Guest Post: 9 AI Tools You Should Try","best ai tools to try"
1091,"Sam Altman: Fired as OpenAI CEO, Hired to Lead Microsoft's New AI Team","sam altman microsoft ai team"
1093,"How We Stay Up to Date with The Latest in AI","how to stay updated on ai"
1095,"OpenAI Is Slowly Killing Prompt Engineering With The Latest ChatGPT and DALL-E Updates","openai prompt engineering changes"
1097,"How to Create Your GPT With The New ChatGPT Feature (And Tips to Make it Unique and Profitable)","create your own gpt"
1099,"OpenAI Just Released GPTs: Create Your Own ChatGPT And Make Money From It (No Coding Required)","create your own gpt"
1101,"Biden's Executive Order on AI Was Necessary. Yet, There's Still A Lot to Do","biden executive order ai safety"
1103,"The ChatGPT Mobile App is Underrated. Here’s How to Make The Most of It","chatgpt mobile app tips"
1105,"How to AI-Proof Your Career","ai-proof your career"
1107,"Guest Post: ChatGPT Reimagines 7 Game of Thrones Characters with Midjourney","game of thrones character art"
1109,"Lesson #1: Improve your Speaking with AI","practice speaking with chatgpt"
1111,"I've Been Using ChatGPT Vision as a Data Analyst. Here Are Some Practical Use Cases","chatgpt vision use cases for data analysts"
1113,"My Quick Guide to Becoming an AI/Tech Writer","how to become an ai writer"
1115,"I’ve Been Using AI To Write Better Articles for Almost 1 Year. Here’s How to Make The Most of It","using ai for writing articles"
1117,"AI Tutorial: How to Clone Your Voice, Create AI Avatars and Translate Your Videos","voice cloning and video translation"
1119,"I Used AI to Translate My Videos. Here's How","ai video translation tool"
1121,"AI is Revolutionizing Video Creation. Here's Why This is Good for You","ai video creation tools"
1123,"How I'd Learn AI from Scratch (If I Could Start Over)","learn ai from scratch"
1125,"ChatGPT Features That I Can’t Live Without","must-have chatgpt features"
1127,"Get Your FREE Cheat Sheet (and more!)","free ai cheat sheet"
1129,"ChatGPT Just Got 2 Amazing Features: Voice and Vision","chatgpt voice and image features"
1131,"6 Chrome Extensions That Unlock Some GPT-4 Features (Without Paying for ChatGPT Plus)","chrome extensions for gpt-4 features"
1133,"Bard Can Now Connect to Your Google Apps","bard google apps integration"
1135,"AI Updates: The AI News That You Might've Missed This Week","ai news updates this week"
1137,"ChatGPT, Do You Love Me?","human ai relationship evolution"
1139,"How ChatGPT Works (In Plain English)","how does chatgpt work"
1141,"AI News — This is What You’ve Missed This Summer","ai news summer highlights"
1143,"Will AI Prompt Engineering Be a Thing in The Future?","will prompt engineering continue"
1145,"ChatGPT Language Prompts: Grammar, Writing Practice, Tone, and Vocabulary","language learning with chatgpt"
1147,"My Journey to Becoming an Effective Learner Using ChatGPT","effective learning with chatgpt"
1149,"My Honest Review of Some Paid AI Tools I’ve Used So Far","paid ai tools review"
1151,"No Matter How Good You're At Programming, If You Don't Have Good Habits","good habits for programmers"
1153,"I've Just Tried Google's New AI Search Engine","google ai search engine review"
1489,"We Tested 100s of Claude Cowork Prompts. These 7 Automate Your Boring Work","automate boring work tasks"
1599,"Stop Asking Claude for (Only) Text. Build This Instead",
1601,"Kubernetes Tutorial For Beginners: 75 Comprehensive Guides",
1612,"Kubernetes Tutorial For Beginners: 75 Comprehensive Guides",
1614,"Jenkins Tutorial For Beginners: 21+ Practical Guides","jenkins tutorial for beginners"
1616,"Become A DevOps Engineer in 2026: [A Practical Roadmap]","how to become a devops engineer"
1618,"From DevOps to MLOps (A Practical Guide for 2026)","devops to mlops transition"
1620,"How to Learn Kubernetes (Beginner to Advanced Resources)","learn kubernetes for beginners"
1622,"Python For DevOps: Guide for DevOps Engineers","python for devops engineers"
1624,"Golang For DevOps: A Complete Guide","golang for devops engineers"
1626,"How to Learn Git for DevOps: Beginners Git Roadmap","learn git for devops"
1628,"How to Learn Linux Shell Scripting for DevOps?",
1630,"Pass the CKA Certification Exam: The Ultimate Study Guide","cka certification study guide"
1632,"CKAD Certification: The Comprehensive Guide for Future CKADs","ckad certification study guide"
1634,"CKAD Certification: The Comprehensive Guide for Future CKADs","ckad certification study guide"
1645,"Argo CD: A Complete Guide to Features, Configurations and Options",
1647,"CKS Exam Study Guide: Resources to Pass Certified Kubernetes Security Specialist","cks exam study guide"
1648,"KCNA Certification: Detailed Study Guide","kcna certification study guide"
1649,"KCSA Certification: The Complete Study Guide With Resources","kcsa certification study guide"
1650,"Prometheus Certified Associate (PCA): Complete Study Guide and Exam Preparation Tips","prometheus certified associate exam guide"
1651,"Certified Argo Project Associate (CAPA) Study Guide","argo project associate certification guide"
1652,"Istio Certified Associate (ICA) Exam Study Guide","istio certified associate exam guide"
1654,"KCNA Certification: Detailed Study Guide","kcna certification study guide"
1655,"From 3.17 GB to 354 MB: How I Reduced My Kubeflow Docker Image by 89%",
1656,"KCSA Certification: The Complete Study Guide With Resources","kcsa certification study guide"
1657,"Prometheus Certified Associate (PCA): Complete Study Guide and Exam Preparation Tips","prometheus certified associate guide"
1658,"Istio Architecture: The Definitive Guide to Ambient Mesh",
1659,"How to Deploy Llama 3 with Docker and vLLM (Full Optimization Guide)",
1660,"How to Use In-Place Pod Resize with VPA in Kubernetes",
1661,"How to Provision Persistent Volume on EKS Cluster","provision persistent volume eks"
1662,"Kubernetes Gateway API Tutorial for Beginner&#x27;s",
1663,"How to Deploy Apache Airflow on Kubernetes",
1664,"How to Setup Feast Feature Store on Kubernetes",
1665,"How To Setup Kubernetes Cluster Using Kubeadm",
1667,"Linux Foundation Certifications: Everything You Need to Know",
